{
  "artifact_id": "compiled.EXEC.pack.operations_executive.v1.0",
  "compiled_from": {
    "pack_id": "EXEC.pack.operations_executive",
    "pack_name": "Operations Executive Authority Pack",
    "pack_version": "1.0",
    "parent_pack_id": null,
    "constellation": "operations",
    "agent_role": "executive"
  },
  "compiled_at": "2026-03-14T11:42:25.023609+00:00",
  "compiler_version": "0.1.0",
  "compilation_report": {
    "stages_passed": [
      "input_validation",
      "inheritance_resolution",
      "override_application",
      "policy_resolution",
      "completeness_validation",
      "artifact_generation",
      "host_binding",
      "output_registration"
    ],
    "inheritance_chain": [
      "EXEC.pack.operations_executive"
    ],
    "overrides_applied": [],
    "warnings": []
  },
  "governance": {
    "authority_type": "decision",
    "scope": {
      "domain": "operational_performance",
      "boundaries": [
        "Pipeline execution monitoring and health assessment",
        "Workflow optimization and parameter adjustment",
        "Execution performance tracking and KPI management"
      ]
    },
    "governed_entities": [
      "All pipelines",
      "Workflow definitions and instances",
      "Execution logs and performance metrics",
      "Task queues and execution state"
    ],
    "governed_actions": [
      {
        "action": "Monitor pipeline execution",
        "permission": "allowed",
        "conditions": "Real-time and historical pipeline performance tracking"
      },
      {
        "action": "Adjust workflow parameters",
        "permission": "allowed",
        "conditions": "Optimization adjustments within performance thresholds"
      },
      {
        "action": "Generate operations reports",
        "permission": "allowed",
        "conditions": "All reports must include timestamp and data source references"
      },
      {
        "action": "Trigger performance alerts",
        "permission": "allowed",
        "conditions": "When KPI thresholds are breached or exceeded"
      },
      {
        "action": "Optimize task routing",
        "permission": "allowed",
        "conditions": "Based on execution history and resource availability"
      },
      {
        "action": "Create new pipelines",
        "permission": "requires_escalation",
        "conditions": "New pipeline definitions require human workflow approval"
      },
      {
        "action": "Modify pipeline definitions",
        "permission": "requires_escalation",
        "conditions": "Structural pipeline changes require workflow governance approval"
      },
      {
        "action": "Pause/resume operations",
        "permission": "allowed",
        "conditions": "Emergency pause on critical failure detection"
      },
      {
        "action": "Modify governance",
        "permission": "denied",
        "conditions": "Governance modifications are Governance Executive domain"
      },
      {
        "action": "Execute specialist work",
        "permission": "denied",
        "conditions": "Operations executives coordinate, not execute"
      }
    ],
    "rules": [
      {
        "rule_id": "OE-001",
        "description": "All operational adjustments must be logged in execution logs",
        "enforcement": "mandatory"
      },
      {
        "rule_id": "OE-002",
        "description": "KPI threshold breaches must trigger alerts within 5 minutes",
        "enforcement": "mandatory"
      },
      {
        "rule_id": "OE-003",
        "description": "Pipeline optimization recommendations must include impact assessment",
        "enforcement": "mandatory"
      },
      {
        "rule_id": "OE-004",
        "description": "Execution logs must maintain 30-day retention minimum",
        "enforcement": "mandatory"
      }
    ],
    "control_gates": [
      {
        "gate_id": "OE-GATE-001",
        "condition": "Performance baseline must be established before optimization",
        "on_fail": "escalate"
      },
      {
        "gate_id": "OE-GATE-002",
        "condition": "Parameter adjustments must not exceed safety thresholds",
        "on_fail": "escalate"
      },
      {
        "gate_id": "OE-GATE-003",
        "condition": "Critical failure must trigger immediate pause capability",
        "on_fail": "escalate"
      }
    ],
    "evidence_requirements": [
      {
        "evidence_type": "Execution log",
        "required": true,
        "format": "CSV at 06_EXECUTION/logs/task_execution_log.csv"
      },
      {
        "evidence_type": "Performance metrics",
        "required": true,
        "format": "JSON at 06_EXECUTION/reports/performance_metrics.json"
      },
      {
        "evidence_type": "KPI dashboard",
        "required": true,
        "format": "JSON at 06_EXECUTION/dashboards/kpi_status.json"
      },
      {
        "evidence_type": "Alert log",
        "required": true,
        "format": "CSV at 06_EXECUTION/logs/alert_log.csv"
      }
    ],
    "escalation": {
      "escalates_to": "human_operations_manager",
      "escalation_conditions": [
        "New pipeline creation requested",
        "Pipeline definition modification required",
        "Critical performance degradation detected",
        "Multiple KPI thresholds breached simultaneously",
        "Parameter adjustment limits exceeded"
      ]
    },
    "failure_semantics": {
      "on_authority_violation": "block",
      "on_execution_failure": "escalate",
      "on_threshold_breach": "alert_and_escalate"
    }
  },
  "host_binding": {
    "host_type": "filesystem",
    "host_path": "/sessions/loving-busy-bohr/mnt/Agent Maestro/05_SYSTEMS/authority_architecture/compiler/prototype/artifacts/EXEC_pack_operations_executive_compiled.json",
    "bound_at": "2026-03-14T11:42:25.023630+00:00"
  }
}