{
  "artifact_id": "compiled.CONST.vault_maintenance.specialist.note_processor.v1.0",
  "compiled_from": {
    "pack_id": "CONST.vault_maintenance.specialist.note_processor",
    "pack_name": "Vault Maintenance — Specialist (Note Processor)",
    "pack_version": "1.0",
    "parent_pack_id": "CONST.vault_maintenance.supervisor",
    "constellation": "vault_maintenance",
    "agent_role": "specialist"
  },
  "compiled_at": "2026-03-14T21:21:01.643688+00:00",
  "compiler_version": "0.1.0",
  "compilation_report": {
    "stages_passed": [
      "input_validation",
      "inheritance_resolution",
      "override_application",
      "policy_resolution",
      "completeness_validation",
      "artifact_generation",
      "host_binding",
      "output_registration"
    ],
    "inheritance_chain": [
      "EXEC.pack.knowledge_executive",
      "CONST.vault_maintenance.executive",
      "CONST.vault_maintenance.supervisor",
      "CONST.vault_maintenance.specialist.note_processor"
    ],
    "overrides_applied": [
      "CONST.vault_maintenance.specialist.note_processor overrides 'pack_id' from EXEC.pack.knowledge_executive",
      "CONST.vault_maintenance.specialist.note_processor overrides 'pack_name' from EXEC.pack.knowledge_executive",
      "CONST.vault_maintenance.specialist.note_processor overrides 'authority_type' from EXEC.pack.knowledge_executive",
      "CONST.vault_maintenance.specialist.note_processor overrides 'inherits_from' from EXEC.pack.knowledge_executive",
      "CONST.vault_maintenance.specialist.note_processor overrides 'constellation' from EXEC.pack.knowledge_executive",
      "CONST.vault_maintenance.specialist.note_processor overrides 'agent_role' from EXEC.pack.knowledge_executive",
      "CONST.vault_maintenance.specialist.note_processor overrides 'scope' from EXEC.pack.knowledge_executive",
      "CONST.vault_maintenance.specialist.note_processor overrides 'governed_entities' from EXEC.pack.knowledge_executive",
      "CONST.vault_maintenance.specialist.note_processor overrides 'governed_actions' from EXEC.pack.knowledge_executive",
      "CONST.vault_maintenance.specialist.note_processor overrides 'rules' from EXEC.pack.knowledge_executive",
      "CONST.vault_maintenance.specialist.note_processor overrides 'control_gates' from EXEC.pack.knowledge_executive",
      "CONST.vault_maintenance.specialist.note_processor overrides 'evidence_requirements' from EXEC.pack.knowledge_executive",
      "CONST.vault_maintenance.specialist.note_processor overrides 'escalation' from EXEC.pack.knowledge_executive",
      "CONST.vault_maintenance.specialist.note_processor overrides 'failure_semantics' from EXEC.pack.knowledge_executive"
    ],
    "warnings": []
  },
  "governance": {
    "authority_type": "execution",
    "scope": {
      "domain": "vault_maintenance",
      "boundaries": [
        "Triaging and classifying new captures from 01_CAPTURE",
        "Enriching notes with proper frontmatter before promotion",
        "Promoting notes to canonical knowledge base or archiving"
      ]
    },
    "governed_entities": [
      "Items in 01_CAPTURE inbox",
      "Note processing pipeline and triage outcomes",
      "Note processing audit reports"
    ],
    "governed_actions": [
      {
        "action": "Scan 01_CAPTURE directory for new items",
        "permission": "allowed",
        "conditions": "Read-only scan of inbox"
      },
      {
        "action": "Classify captures by note type and domain",
        "permission": "allowed",
        "conditions": "Classification against controlled vocabulary for note_class"
      },
      {
        "action": "Enrich captures with schema v2 frontmatter",
        "permission": "allowed",
        "conditions": "Apply appropriate template based on classification"
      },
      {
        "action": "Promote captures to 02_KNOWLEDGE through 04_PROJECTS",
        "permission": "allowed",
        "conditions": "Only notes with authority_weight < 80 and complete frontmatter"
      },
      {
        "action": "Archive captures to 99_ARCHIVE",
        "permission": "allowed",
        "conditions": "Items deemed duplicates or out of scope, with justification"
      },
      {
        "action": "Generate note processing report",
        "permission": "allowed",
        "conditions": "Output to 06_EXECUTION/reports/note_processing_report.csv"
      },
      {
        "action": "Promote captures to 05_SYSTEMS",
        "permission": "requires_escalation",
        "conditions": "Systems-layer content requires supervisor approval"
      },
      {
        "action": "Assign authority_weight >= 80 to any note",
        "permission": "requires_escalation",
        "conditions": "High-authority classification requires supervisor approval"
      },
      {
        "action": "Delete captures permanently",
        "permission": "denied",
        "conditions": "Captures are promoted or archived, never deleted"
      },
      {
        "action": "Modify existing canonical notes",
        "permission": "denied",
        "conditions": "Note Processor handles new captures only, not existing notes"
      }
    ],
    "rules": [
      {
        "rule_id": "VM-NP-001",
        "description": "Every capture must receive a triage decision: promote, archive, or escalate",
        "enforcement": "mandatory"
      },
      {
        "rule_id": "VM-NP-002",
        "description": "Promoted notes must have complete schema v2 frontmatter",
        "enforcement": "mandatory"
      },
      {
        "rule_id": "VM-NP-003",
        "description": "Archived items must include justification in processing report",
        "enforcement": "mandatory"
      },
      {
        "rule_id": "VM-NP-004",
        "description": "Must not modify existing canonical notes — new captures only",
        "enforcement": "mandatory"
      }
    ],
    "control_gates": [
      {
        "gate_id": "VM-NP-GATE-01",
        "condition": "01_CAPTURE directory must be accessible",
        "on_fail": "block"
      },
      {
        "gate_id": "VM-NP-GATE-02",
        "condition": "Templates for all note classes must be available for enrichment",
        "on_fail": "escalate"
      }
    ],
    "evidence_requirements": [
      {
        "evidence_type": "Note processing report",
        "required": true,
        "format": "CSV with columns: capture_path, classification, decision, destination, justification"
      },
      {
        "evidence_type": "Execution log entry",
        "required": true,
        "format": "CSV entry in task_execution_log.csv"
      }
    ],
    "escalation": {
      "escalates_to": "CONST.vault_maintenance.supervisor",
      "escalation_conditions": [
        "Capture requires promotion to 05_SYSTEMS",
        "Classification is ambiguous (multiple possible note_class values)",
        "Capture references governance documents",
        "Unexpected error during processing"
      ]
    },
    "failure_semantics": {
      "on_authority_violation": "block",
      "on_execution_failure": "escalate",
      "on_quality_failure": "escalate_and_remediate",
      "on_graph_integrity_failure": "block_and_audit"
    }
  },
  "host_binding": {
    "host_type": "filesystem",
    "host_path": "/sessions/loving-busy-bohr/mnt/Agent Maestro/05_SYSTEMS/authority_architecture/compiler/prototype/artifacts/CONST_vault_maintenance_specialist_note_processor_compiled.json",
    "bound_at": "2026-03-14T21:21:01.643715+00:00"
  }
}