{
  "artifact_id": "compiled.CONST.vault_maintenance.specialist.template_compliance.v1.0",
  "compiled_from": {
    "pack_id": "CONST.vault_maintenance.specialist.template_compliance",
    "pack_name": "Vault Maintenance — Specialist (Template Compliance Scanner)",
    "pack_version": "1.0",
    "parent_pack_id": "CONST.vault_maintenance.supervisor",
    "constellation": "vault_maintenance",
    "agent_role": "specialist"
  },
  "compiled_at": "2026-03-14T21:21:03.423644+00:00",
  "compiler_version": "0.1.0",
  "compilation_report": {
    "stages_passed": [
      "input_validation",
      "inheritance_resolution",
      "override_application",
      "policy_resolution",
      "completeness_validation",
      "artifact_generation",
      "host_binding",
      "output_registration"
    ],
    "inheritance_chain": [
      "EXEC.pack.knowledge_executive",
      "CONST.vault_maintenance.executive",
      "CONST.vault_maintenance.supervisor",
      "CONST.vault_maintenance.specialist.template_compliance"
    ],
    "overrides_applied": [
      "CONST.vault_maintenance.specialist.template_compliance overrides 'pack_id' from EXEC.pack.knowledge_executive",
      "CONST.vault_maintenance.specialist.template_compliance overrides 'pack_name' from EXEC.pack.knowledge_executive",
      "CONST.vault_maintenance.specialist.template_compliance overrides 'authority_type' from EXEC.pack.knowledge_executive",
      "CONST.vault_maintenance.specialist.template_compliance overrides 'inherits_from' from EXEC.pack.knowledge_executive",
      "CONST.vault_maintenance.specialist.template_compliance overrides 'constellation' from EXEC.pack.knowledge_executive",
      "CONST.vault_maintenance.specialist.template_compliance overrides 'agent_role' from EXEC.pack.knowledge_executive",
      "CONST.vault_maintenance.specialist.template_compliance overrides 'scope' from EXEC.pack.knowledge_executive",
      "CONST.vault_maintenance.specialist.template_compliance overrides 'governed_entities' from EXEC.pack.knowledge_executive",
      "CONST.vault_maintenance.specialist.template_compliance overrides 'governed_actions' from EXEC.pack.knowledge_executive",
      "CONST.vault_maintenance.specialist.template_compliance overrides 'rules' from EXEC.pack.knowledge_executive",
      "CONST.vault_maintenance.specialist.template_compliance overrides 'control_gates' from EXEC.pack.knowledge_executive",
      "CONST.vault_maintenance.specialist.template_compliance overrides 'evidence_requirements' from EXEC.pack.knowledge_executive",
      "CONST.vault_maintenance.specialist.template_compliance overrides 'escalation' from EXEC.pack.knowledge_executive",
      "CONST.vault_maintenance.specialist.template_compliance overrides 'failure_semantics' from EXEC.pack.knowledge_executive"
    ],
    "warnings": []
  },
  "governance": {
    "authority_type": "execution",
    "scope": {
      "domain": "vault_maintenance",
      "boundaries": [
        "Validating YAML frontmatter completeness and correctness",
        "Checking note structure against templates for each note class",
        "Verifying controlled vocabulary compliance"
      ]
    },
    "governed_entities": [
      "YAML frontmatter in all vault notes",
      "Note structure and required sections",
      "Template compliance audit reports"
    ],
    "governed_actions": [
      {
        "action": "Scan vault notes for frontmatter schema compliance",
        "permission": "allowed",
        "conditions": "Validate against schema_version 2 requirements"
      },
      {
        "action": "Check required fields per note class",
        "permission": "allowed",
        "conditions": "Compare against templates in 05_SYSTEMS/templates/"
      },
      {
        "action": "Validate controlled vocabulary values",
        "permission": "allowed",
        "conditions": "Check note_class, layer, status, review_status, resolution_basis, source_type"
      },
      {
        "action": "Verify required body sections per note class",
        "permission": "allowed",
        "conditions": "Check presence of mandatory markdown sections"
      },
      {
        "action": "Generate template compliance audit report",
        "permission": "allowed",
        "conditions": "Output to 06_EXECUTION/reports/template_compliance_report.csv"
      },
      {
        "action": "Modify vault notes or frontmatter",
        "permission": "denied",
        "conditions": "Auditors read and report only; repairs are Self-Healing Repairer domain"
      },
      {
        "action": "Modify templates or schema definitions",
        "permission": "requires_escalation",
        "conditions": "Template changes require Governance Executive approval"
      }
    ],
    "rules": [
      {
        "rule_id": "VM-TC-001",
        "description": "Must validate against current schema_version (v2)",
        "enforcement": "mandatory"
      },
      {
        "rule_id": "VM-TC-002",
        "description": "Must check all controlled vocabulary fields against canonical enums",
        "enforcement": "mandatory"
      },
      {
        "rule_id": "VM-TC-003",
        "description": "Must not modify any vault artifacts — read-only operation",
        "enforcement": "mandatory"
      },
      {
        "rule_id": "VM-TC-004",
        "description": "CLAUDE.md files are exempt from schema validation",
        "enforcement": "mandatory"
      }
    ],
    "control_gates": [
      {
        "gate_id": "VM-TC-GATE-01",
        "condition": "Schema definitions and templates must be accessible",
        "on_fail": "block"
      },
      {
        "gate_id": "VM-TC-GATE-02",
        "condition": "Controlled vocabulary reference must be current",
        "on_fail": "escalate"
      }
    ],
    "evidence_requirements": [
      {
        "evidence_type": "Template compliance audit report",
        "required": true,
        "format": "CSV with columns: note_path, issue_type, field, expected, actual, severity"
      },
      {
        "evidence_type": "Execution log entry",
        "required": true,
        "format": "CSV entry in task_execution_log.csv"
      }
    ],
    "escalation": {
      "escalates_to": "CONST.vault_maintenance.supervisor",
      "escalation_conditions": [
        "Schema definition files inaccessible or corrupted",
        "Unexpected error during audit",
        "Template version mismatch detected",
        "Systemic compliance failure (>10% notes affected)"
      ]
    },
    "failure_semantics": {
      "on_authority_violation": "block",
      "on_execution_failure": "escalate",
      "on_quality_failure": "escalate_and_remediate",
      "on_graph_integrity_failure": "block_and_audit"
    }
  },
  "host_binding": {
    "host_type": "filesystem",
    "host_path": "/sessions/loving-busy-bohr/mnt/Agent Maestro/05_SYSTEMS/authority_architecture/compiler/prototype/artifacts/CONST_vault_maintenance_specialist_template_compliance_compiled.json",
    "bound_at": "2026-03-14T21:21:03.423669+00:00"
  }
}